"conversation_id_str","created_at","favorite_count","full_text","id_str","image_url","in_reply_to_screen_name","lang","location","quote_count","reply_count","retweet_count","tweet_url","user_id_str","username"
"2071203257364480192","Sun Jun 28 12:05:12 +0000 2026","3519","Beras naik minyak naik yang tadinya bensin beli pertamax beralih jadi pertalite. Kaum middle class emang akan dimiskinkan p3m3r1nt4h https://t.co/y6zqczEFqG","2071203257364480192","https://pbs.twimg.com/media/HL5kYwRXYAAyumG.png","","in","","27","99","343","https://x.com/undefined/status/2071203257364480192","1331650559518990336",
"2071070093706936523","Sun Jun 28 03:16:03 +0000 2026","1735","Bensin makin mahal. Kayaknya kudu latihan biar bisa jadi Sk8er boy ... https://t.co/Bj2vEzP3cP","2071070093706936523","https://pbs.twimg.com/amplify_video_thumb/2071069985880047617/img/eZvxziiBRbUiF1PF.jpg","","in","","74","125","181","https://x.com/undefined/status/2071070093706936523","1334070788060631040",
"2067217687378608159","Wed Jun 17 12:07:58 +0000 2026","14075","Pendapat Ahok soal demo mahasiswa: - Tidak perlu takut demo hadapi langsung tanya maunya apa - Tuntutan mahasiswa wajar soal penghematan - Sarankan bubarkan BGN ganti voucher digital - Sindir e-KTP yang tidak dimanfaatkan untuk subsidi langsung - Tantang pemerintah buka https://t.co/XWyYtG6VRJ","2067217687378608159","https://pbs.twimg.com/media/HLA6sMgbwAEIl7-.jpg","","in","","76","166","3534","https://x.com/undefined/status/2067217687378608159","1772323119111487490",
"2071590661326016655","Mon Jun 29 13:44:36 +0000 2026","1183","beredar surat dari TNI isinya minta: - Koperasi Purnawirawan TNI-AD Jabar - Minta beli 3 kaos logo mereka - Harga Rp100.000/kaos - Ditujukan ke instansi pemerintah &amp; swasta - Intinya: minta sumbangan berkedok jual kaos https://t.co/DTd7PufUzI","2071590661326016655","https://pbs.twimg.com/media/HL_EuT4bEAASo44.jpg","","in","","17","160","414","https://x.com/undefined/status/2071590661326016655","1772323119111487490",
"2071044066125746623","Sun Jun 28 01:32:38 +0000 2026","10611","Ha? Gimana nggak mau rusak BUMN. Uang pajak rakyat kok dipake buat gaji yang beginian https://t.co/pBOsaIq7Fg","2071044066125746623","https://pbs.twimg.com/media/HL3Tma3bAAAyTHu.jpg","","in","","224","411","3434","https://x.com/undefined/status/2071044066125746623","1752301333263392769",
"1208910524475310080","Mon Dec 23 00:41:44 +0000 2019","1437","Hutang numpuk subsidi dicabut PLN-BPJS-GAS-BBM-Pajak naik rerata BUMN-pun Rugi..APBN msh defisit Rp368T? Sebenarnya negara ini sedang diurus apa dikuras ? #China_is_terrorist #China_is_terroris Defisit APBN 2019 Tembus Rp368 T Sampai November https://t.co/j1yzF0MkWW","1208910524475310080","","","in","","98","243","824","https://x.com/undefined/status/1208910524475310080","308824504",
"2023937745794851192","Wed Feb 18 01:48:56 +0000 2026","36878","Menyambut bulan puasa mari saling maaf memaafkan. Semua dimaafkan kecuali pemerintah","2023937745794851192","","","in","","192","309","16003","https://x.com/undefined/status/2023937745794851192","1422951168",
"2014179709081514495","Thu Jan 22 03:33:58 +0000 2026","16148","Miris setiap dengar siswa berprestasi tapi tidak bisa lanjut kuliah karena keterbatasan ekonomi tambah emosi meneh anggaran pendidikan dipotong dinggo MBG umpomo dinggo beasiswa opo subsidi kuliah ngono kan malah faedah taek tenan kok pemerintah sing gawe kebijakan..","2014179709081514495","","","in","","99","49","5148","https://x.com/undefined/status/2014179709081514495","1144577610",
"1629048107538472961","Fri Feb 24 09:18:29 +0000 2023","42520","Sudah bayar pajak. Ke depannya bagaimana? Sebagai warga negara akan tetap bayar pajak. Tapi saya ingin sekali saja merasa bahagia seberes bayar pajak; bahagia bahwa uang saya dipakai untuk pembangunan negeri ini. Sedihnya yang muncul akhir-akhir ini malah rasa tidak percaya https://t.co/xh3HXjlYGo","1629048107538472961","https://pbs.twimg.com/media/FpuKm8UakAI1f4F.jpg","","in","","459","1159","4702","https://x.com/undefined/status/1629048107538472961","1422951168",
"2072336566459216009","Wed Jul 01 15:08:34 +0000 2026","2512","Syukurlah jika dimulai dari Kudus. Sejak surat anak SMK yang meminta dana MBG diberikan saja untuk honor gurunya bukannya disetujui malah diteror. Sekarang kita tahu alasan teror itu kenapa. https://t.co/w9R1XQGhzm","2072336566459216009","https://pbs.twimg.com/media/HMJrHzuboAArRco.jpg","","in","","9","15","1358","https://x.com/undefined/status/2072336566459216009","68331085",
"1719011599674225077","Mon Oct 30 15:21:17 +0000 2023","44139","Presiden berkata Indonesia mengutuk keras. Bahkan dari alinea pertama pembukaan UUD 1945 saja seharusnya cukup membuat kita mengerti harus berpihak ke mana. Yg satu memperjuangkan tanah air yg satu melakukan genosida. Kalau memang pikiranmu tidak sampai pakai hati nurani coba","1719011599674225077","","","in","","285","458","13794","https://x.com/undefined/status/1719011599674225077","1422951168",
"1218022248600068097","Fri Jan 17 04:10:40 +0000 2020","9","@ViscyErvaa Bae-bae dicariin orang pajak","1218022803665895424","","","in","","0","1","1","https://x.com/undefined/status/1218022803665895424","1422951168",
"2071932941698310594","Tue Jun 30 12:24:42 +0000 2026","2066","Ijazah itu tanda orang perna sekolah bukan tanda orang berpikir. Contohnya ini walau sudah selesai wisuda tapi masih aja otak-nya tidak guna. Mau bagaimana lagi sdm kita rendah disogok kaos saja luluh apalagi di suap bansos dll. https://t.co/tutBBmkull","2071932941698310594","https://pbs.twimg.com/amplify_video_thumb/2071932817429221376/img/tW93LLWO4YMmltI_.jpg","","in","","41","326","420","https://x.com/undefined/status/2071932941698310594","1745265761416056832",
"2072242127913058335","Wed Jul 01 08:53:18 +0000 2026","5572","Y ALL BEASISWA TELADAN UDAH BUKAAA! LANGSUNG GREBEK PLS BIAR KALIAN GAK PERLU BAYAR UKT SAMPE LULUS! https://t.co/50Lt08edsI","2072242127913058335","https://pbs.twimg.com/media/HMIVOdcbgAA8XFl.jpg","","in","","83","66","590","https://x.com/undefined/status/2072242127913058335","1870122261598097408",
"2072215950888427768","Wed Jul 01 07:09:17 +0000 2026","1723","Tahun 2023 Rocky Gerung pernah nyebut Jokowi bajingan tolol sampai dipolisikan PDIP. Bandingin sama kritiknya ke Prabowo? Main aman di evaluasi kebijakan yang masih terjaga jaraknya kritik nyalahin ke level menteri aja. Ya bukan kebetulan jg kalau ditelusuri lingkaran https://t.co/HI2pPJo9Yc","2072215950888427768","https://pbs.twimg.com/media/HMH9bHcasAAdy8v.jpg","","in","","18","94","488","https://x.com/undefined/status/2072215950888427768","2022947167829397507",
"2073336877579653614","Sat Jul 04 09:23:27 +0000 2026","767","Klean kurang ajar dan biadab Bocoran dari Kisman Larumakuluta dalam Podcast Roemah Pemoeda hampir seluruh menteri wamen hingga kepala badan menerima dana pribadi sebesar Rp 3 M hingga Rp 5 miliar usai dilantik agar fokus bekerja dan tidak tergoda korupsi https://t.co/x4ruYPN2cx","2073336877579653614","https://pbs.twimg.com/amplify_video_thumb/2073336432710791168/img/ly2OoAVzlBNOPLf3.jpg","","in","","29","91","465","https://x.com/undefined/status/2073336877579653614","721590341669748736",
"1896832136667377670","Tue Mar 04 07:56:37 +0000 2025","45648","Presiden joget Wapres planga plongo Korupsi di mana-mana Koruptor bisa menang pilkada Bensin dioplos Subsidi dicabut Semua program diefisiensi Mata uang kalah sama dollar PHK di mana-mana Kerjaan non-kartap Makan siang gak ada gizi Ujan sedikit banjir","1896832136667377670","","","in","","467","467","14174","https://x.com/undefined/status/1896832136667377670","59987088",
"2068250122027508156","Sat Jun 20 08:30:29 +0000 2026","5744","pendapat Ahok soal program MBG prabowo: - Buat apa BGN? Kalau gw presiden langsung bubarin! - Ganti pakai sistem voucher digital kayak subsidi BBM - Manfaatkan e-KTP yang sudah ada chip-nya kenapa enggak dipakai? - Subsidi langsung ke rakyat lewat KTP - bukan lewat dapur yang https://t.co/nJpNsw0UUH","2068250122027508156","https://pbs.twimg.com/media/HLPmBDsaYAAKurz.jpg","","in","","71","264","1082","https://x.com/undefined/status/2068250122027508156","1772323119111487490",
"2073299557509726233","Sat Jul 04 06:55:09 +0000 2026","206","sch! SIAPA YANG MAU IKUT KELAS GRATIS PERSIAPAN BEASISWA UNGGULAN GUYS Aku ada info kelas gratis persiapan beasiswa unggulan + coding python GRATIS TIS kalau mau tau drop @ kaliann https://t.co/zbebVCdvmF","2073299557509726233","https://pbs.twimg.com/media/HMXW9e8W0AAiidv.jpg","","in","","0","138","12","https://x.com/undefined/status/2073299557509726233","1201673806156161025",
"2073193841281147046","Fri Jul 03 23:55:04 +0000 2026","5750","Fyi wni kalo mau kerja itu: 1. Punya pengalaman 2. Pendidikan minimal &amp; berbagai syarat 3. Ada batasan umur 4. Ga boleh ada rekam jejak kriminal Tapi 1. Gaji mungil 2. Pajak banyak 3. Bahan pokok/barang serba mahal Sedangkan pejabat kalian tajir melintir ","2073193841281147046","","","in","","20","81","1184","https://x.com/undefined/status/2073193841281147046","1331650559518990336",
"2073394702821539851","Sat Jul 04 13:13:13 +0000 2026","489","kalian percaya gk satu orang bisa handle puluhan PT sekaligus? disamping jadi stafsus presiden dan masih ngonten + acara di tv? https://t.co/1xMzzy5riZ","2073394702821539851","https://pbs.twimg.com/media/HMYtfZhaAAAE4_6.jpg","","in","","5","59","60","https://x.com/undefined/status/2073394702821539851","1772323119111487490",
"2070752165225025715","Sat Jun 27 06:12:43 +0000 2026","1950","Tanggal 1 Juli 2026 akan jadi kesaksian terakhir dari pihak Presiden (Pemerintah) menghadirkan saksi dan saksi ahli pada gugatan UU APBN 2026 yang menggugat keberadaan Program Makan Bergizi (MBG). Tebak siapa orang yang berani menelan bulat program MBG yang kepala Badannya","2070752165225025715","","","in","","9","49","1002","https://x.com/undefined/status/2070752165225025715","88120377",
"2071589727262925053","Mon Jun 29 13:40:53 +0000 2026","2192","Kenapa Arab Saudi ngomentarin MBG? Yahh gak masuk di logika kultur arab cuk Sekarang Arab Saudi di bawah Pangeran Mohammed bin Salman (MBS) lagi gila-gilanya mendewakan konsep Efisiensi Privatisasi dan Kapitalisme Modern lewat proyek Vision 2030. MBS itu paling benci sama https://t.co/k30tpNUDHg","2071589727262925053","https://pbs.twimg.com/media/HL_D0uBaMAAV58T.jpg","","in","","8","38","691","https://x.com/undefined/status/2071589727262925053","1090191916560396288",
"2071371577737027857","Sun Jun 28 23:14:03 +0000 2026","5739","Level kegoblokan presiden: milih pejabat negara setingkat menteri cuman berdasarkan loyalitas giliran sadar kalo pembantu²nya yang loyal itu lack of intelligence dan gak becus nyari solusi buat pelbagai masalah bangsa malah begging ke akademisi buat bantu. Are u dumb @prabowo?","2071371577737027857","","","in","","26","63","2725","https://x.com/undefined/status/2071371577737027857","2005984164118777856",
"2072535750105784392","Thu Jul 02 04:20:03 +0000 2026","2083","Pake BPJS di Puskesmas Jakarta bikin culture shock. 1. Pelayanan konsultasinya lebih bagus dan nyaman dari RS Swasta premium di Jakarta (pengalaman pribadi) 2. Gratis tis tis. Thanks to BPJS poros sosialisme Indonesia 3. Puskesmas rasa Rumah Sakit. 4 lantai dan punya https://t.co/1VeN5nI44y","2072535750105784392","https://pbs.twimg.com/media/HMMgRn0aAAAt5ev.jpg","","in","","187","181","387","https://x.com/undefined/status/2072535750105784392","177760518",
"2070712220649226667","Sat Jun 27 03:34:00 +0000 2026","827","klarifikasi pemerintah soal 4 calon manajer kopdes yang meningg4l : - Program tetap jalan karena tujuan kita besar menggerakkan ekonomi desa - Pelatih tidak akan turunkan standar mereka melatih abdi negara - Negara lain juga lakukan Singapura Korea Prancis punya program serupa https://t.co/TEUaz6teEN","2070712220649226667","https://pbs.twimg.com/media/HLyh7FwaMAAeszR.jpg","","in","","135","313","203","https://x.com/undefined/status/2070712220649226667","1772323119111487490",
"2071095100919439870","Sun Jun 28 04:55:25 +0000 2026","2436","pengakuan sonny BGN soal korupsi MBG: - 26 nama disebut Sony di pemeriksaan pertama minta jatah SPPG - Di pemeriksaan kedua jaksa buka langsung HP Sony satu per satu - ada orang minta ubah yayasan dapur SPPG sudah 3 kali diubah - kalian tau lah ya siapa itu - ada satu orang https://t.co/2TVTQp52vk","2071095100919439870","https://pbs.twimg.com/media/HL4BigAbYAA6vN8.jpg","","in","","29","92","761","https://x.com/undefined/status/2071095100919439870","1772323119111487490",
"1148154587703996416","Mon Jul 08 09:00:27 +0000 2019","10","@dedistyawan_ Geblek dah stand monitor-nya saja 14 juta belum sama cukai dan pajak","1148154869552832514","","","in","","0","1","0","https://x.com/undefined/status/1148154869552832514","1422951168",
"1340555009470078977","Sun Dec 20 07:09:55 +0000 2020","3576","Usul Urutan Vaksin: 1. Presiden. 2. Wakil Presiden. 3. Ketua MPR. 4. Ketua DPR. 5. Ketua DPD. 6. Ketua MA. 7. Ketua MK. 8. Menteri Kesehatan. 9. Kapolri. 10. Panglima TNI. 11....lanjutkan. #YakinkanRakyat","1340555009470078977","","","in","","160","842","624","https://x.com/undefined/status/1340555009470078977","120968478",
"651416514780749825","Tue Oct 06 15:19:34 +0000 2015","13","Sementara beberapa kawan mengingatkan bapak presiden untuk bertindak jangan lupa juga ya untuk beraksi nyata http://t.co/s3TS5cpG51","651416514780749825","https://pbs.twimg.com/media/CQpL1QEUkAApxT3.jpg","","in","","0","0","111","https://x.com/undefined/status/651416514780749825","1422951168",
"2072305380101615724","Wed Jul 01 13:04:38 +0000 2026","4661","Won't be buying the PS6 if it doesn't support physical games. @PlayStation @Sony #NOTBUYINGPS6 #NOTBUYINGPS6","2072305380101615724","","","en","","33","268","729","https://x.com/undefined/status/2072305380101615724","762277482238050304",
"1364802605902303233","Thu Feb 25 05:01:12 +0000 2021","25474","Salah satu hal tersulit yang dilakukan adalah: Menahan diri ngomong kasar. Sekarang kalau marah sama sesuatu dan hampir kelepasan langsung dialihkan. Kon ... ci kesuksesan adalah kerja keras. Ngen ... dalikan amarah butuh usaha. Anj ... uran pemerintah makin tidak masuk akal","1364802605902303233","","","in","","219","502","4009","https://x.com/undefined/status/1364802605902303233","1422951168",
"1453144608754442242","Tue Oct 26 23:40:47 +0000 2021","30375","Yang shut up ditindas yang speak up disomasi. Yang mau dipilih minta suara yang udah terpilih membungkam suara. Yang salah enggak mau kalah yang jadi korban malah mengalah. Negeriku lucu subsidi humornya merata","1453144608754442242","","","in","","180","380","5747","https://x.com/undefined/status/1453144608754442242","1422951168",
"2070673806990213380","Sat Jun 27 01:01:21 +0000 2026","3060","Aparat halangi pengacara dan ibu dari anak yang ditangkap saat demo di Gedung Grahadi Surabaya kemarin. YLBHI Surabaya https://t.co/YOzjmzuUli","2070673806990213380","https://pbs.twimg.com/amplify_video_thumb/2070673733577211904/img/en0zxNA6KCeCPnNX.jpg","","in","","21","55","1482","https://x.com/undefined/status/2070673806990213380","1478639074038607872",
"2072199022002200840","Wed Jul 01 06:02:01 +0000 2026","2486","kasus generasi muda yang di jegal pemerintah : - Ibrahim Arief bantu IT pendidikan → penjara tidak ada aliran dana - Amsal Sitepu jasa editing → dianggap harus gratis dakwa korupsi - Nadiem makarim chromebook- hemat uang negara → 15 tahun tanpa bukti - White-Hat https://t.co/4tg0MXXFsY","2072199022002200840","https://pbs.twimg.com/media/HMHtqNIa4AAKYs6.jpg","","in","","9","52","789","https://x.com/undefined/status/2072199022002200840","1772323119111487490",
"2070695517043204177","Sat Jun 27 02:27:37 +0000 2026","83","Punya gaji selangit dan sering wara-wiri pakai mobil mewah bermerek tapi di pom bensin masih ngantre BBM subsidi? Menteri ESDM Bahlil Lahadalia baru saja melempar sentilan menohok yang dijamin bikin telinga para elit langsung panas! Dalam acara CNBC Indonesia Energy Forum https://t.co/rYdP4H0TJO","2070695517043204177","https://pbs.twimg.com/amplify_video_thumb/2070695451767242752/img/8I5pXcJDO39FEjDA.jpg","","in","","3","14","22","https://x.com/undefined/status/2070695517043204177","1289954556411969537",
"2073373561230909614","Sat Jul 04 11:49:13 +0000 2026","140","perbandingan Prabowo dulu vs sekarang menurut raymond chin: Dulu (masa oposisi): - 2013: Pidato soal kerusakan hutan dengan data spesifik (70 juta hektar rusak). - 2014: Perlu pemerintahan yang ramping bersih efisien jangan diperbanyak untuk bagi-bagi jabatan. - 2014: https://t.co/8A6ABlhvRG","2073373561230909614","https://pbs.twimg.com/media/HMYZgF8awAAXgcq.jpg","","in","","3","17","32","https://x.com/undefined/status/2073373561230909614","1772323119111487490",
"2070789771774107780","Sat Jun 27 08:42:09 +0000 2026","1679","Presiden Soekarno dan istrinya Dewi terbang dengan helikopter dari Jakarta ke Palabuhanratu untuk meninjau pembangunan Samudra Beach Hotel yang sudah hampir rampung. Hotel ini dibangun pada 1962 dan dibuka pada Februari 1966 dibiayai dana pampasan perang Jepang. Selain hotel https://t.co/gqHuxQi5BU","2070789771774107780","https://pbs.twimg.com/media/HLzsThJbUAAZ600.jpg","","in","","23","39","324","https://x.com/undefined/status/2070789771774107780","3693924554",
"2071939767051432156","Tue Jun 30 12:51:49 +0000 2026","11942","Ya Allah mau gaji pokok 8 juta/bulan tunjangan fungsional transportasi dapet maksi ada THR bonus bulanan tunjangan presensi BPJS Kes &amp; Kt lingkungan kerja greenflag bs pulang tenggo 5 hari kerja atasan humanis fasilitas kantor++. Nanti ak janji gak ngopi dehhh","2071939767051432156","","","in","","182","92","3135","https://x.com/undefined/status/2071939767051432156","1984849804112105472",
"1559827252548112385","Wed Aug 17 08:59:31 +0000 2022","2838","Petinggi negeri joget gembira di hari kemerdekaan ketika rakyat justru dijajah. Harga pangan naik pajak naik PHK dimana2 bbm naik utang naik rupiah melemah APBN disedot proyek bermasalah seperti KCIC dan IKN btw keren gak sih ? https://t.co/Z2FCD444Qj","1559827252548112385","https://pbs.twimg.com/ext_tw_video_thumb/1559827206393970688/pu/img/gGmKgPDwQaanfEcw.jpg","","in","","243","648","1054","https://x.com/undefined/status/1559827252548112385","227320530",
"1797822760858845368","Tue Jun 04 02:48:42 +0000 2024","10531","Keren ini. Rohingya ditampung Gaza ditampung Rakyat sendiri menghadapi - harga beras naik - BBM naik - UKT naik* - Sembako naik - transport naik - cicilan naik - pajak naik - potongan Tapera - potongan BPJS kesehatan - potongan ketenagakerjaan - terjerat pinjol - dll. https://t.co/wZClWAsPRG","1797822760858845368","https://pbs.twimg.com/media/GPMmRg-bgAAjBdk.jpg","","in","","429","789","2413","https://x.com/undefined/status/1797822760858845368","84221579",
"2072954243091435823","Fri Jul 03 08:02:59 +0000 2026","10670","bangsat bgt prabowo coba mbg dihapus diganti kuliah gratis berapa banyak coba anak yg bisa kuliah tanpa mikir gimana bayar ukt gila emang negara ini https://t.co/J8ZrRW3wKB","2072954243091435823","https://pbs.twimg.com/media/HMSc5RRa0AAp353.jpg","","in","","179","78","2394","https://x.com/undefined/status/2072954243091435823","1864867977675575296",
"2072960767893311791","Fri Jul 03 08:28:55 +0000 2026","3118","Pertanyaan Saldi Isra berhasil membuka mata publik terkait MBG https://t.co/9XicCueRUn","2072960767893311791","https://pbs.twimg.com/amplify_video_thumb/2072960707151466496/img/3_Z5tclNKsfDqQSG.jpg","","in","","19","22","999","https://x.com/undefined/status/2072960767893311791","721590341669748736",
"2073376936328675825","Sat Jul 04 12:02:37 +0000 2026","338","curhatan pengusaha MBG Di karimunjawa (wilayah 3T): - Bangunan dapur sudah siap dari November 2025 - tapi sampai sekarang belum beroperasi - janji realisasi terus molor - dari Januari→Februari→Juni→Juli - Anggaran dipotong drastis oknum - dari Rp1 2 M disetujui cair cuma https://t.co/pcZx8VOElk","2073376936328675825","https://pbs.twimg.com/media/HMYcirzbQAAHTGC.jpg","","in","","1","51","100","https://x.com/undefined/status/2073376936328675825","1772323119111487490",
"2072791007163548116","Thu Jul 02 21:14:21 +0000 2026","5170","Wow beraninya ️.. CERDAS BUKAN KARENA MBG Betapa Beraninya Guru Wonosobo Ini Memprotes Mbg Langsung Di Depan Pejabat Daerah https://t.co/7WUw6c1KTI","2072791007163548116","https://pbs.twimg.com/amplify_video_thumb/2072790919846498304/img/GdYiApNvchj85HKu.jpg","","in","","36","99","2060","https://x.com/undefined/status/2072791007163548116","2412572689",
"1858020826999828681","Sun Nov 17 05:34:20 +0000 2024","11452","Ada 10 pungutan yang berisiko naik di 2025. Ada PPN TAPERA BPJS Kesehatan uang kuliah tunggal (UKT) mahasiswa cukai third party liability untuk asuransi wajib kendaraan bermotor Pajak Penghasilan (PPh) usaha mikro kecil menengah (UMKM) subsidi kereta rel listrik (KRL)","1858020826999828681","","","in","","500","122","6757","https://x.com/undefined/status/1858020826999828681","1746826606847700993",
"2071865320827224199","Tue Jun 30 07:56:00 +0000 2026","9011","jobless behaviour lo semua better kerahin skill elu ini ke pemerintah","2071865320827224199","","","in","","15","31","2016","https://x.com/undefined/status/2071865320827224199","1550881431613648898",
"2071143629486235992","Sun Jun 28 08:08:15 +0000 2026","3809","Yang gak ngikutin timnas korsel pasti mikirnya ini lebay tapi kalo yg tau gimana kacaunya KFA after Asian cup 2023 pasti sangat mewajarkan kenapa knet menteri presiden marah sama hasil timnas korsel di pildun 2026. Ini tuh puncak dari kepemimpinan Chung Monggyu yang korup-","2071143629486235992","","","in","","50","22","361","https://x.com/undefined/status/2071143629486235992","1648981067397992448",
"618089723295199233","Mon Jul 06 16:10:48 +0000 2015","22","Semoga Tuhan mengampuni dosa orang2 yang sering broadcast pin di BBM spam iklan di Instagram dan copas tweet tanpa izin di Twitter. Amin","618089723295199233","","","in","","0","8","223","https://x.com/undefined/status/618089723295199233","1422951168",
"2073334887697047635","Sat Jul 04 09:15:32 +0000 2026","219","Menang Johor Pun Saya Perdana Menteri Kalah Pun Saya PM Bukan Sombong You Cakap Cermat Sikit Lah Perkembangan terkini sempena Pilihanraya Dewan Undangan Negeri (DUN) Johor ke-16. Video: Aqira Azemi #malaysiagazette #PRNJohor #JohorMemilih #PRNJohor2026 #UndiJohor https://t.co/PTCtkd5ChV","2073334887697047635","https://pbs.twimg.com/amplify_video_thumb/2073332758026559488/img/X6fEhNu2gCJFjxuA.jpg","","in","","29","64","42","https://x.com/undefined/status/2073334887697047635","1600369057",
"1826859264184647716","Fri Aug 23 05:49:24 +0000 2024","30288","Abang-abangan dengan template Kamu kok baru berisik sekarang? Kok cuma soal isu ini aja? Fomo ya? udah mulai beraksi. Lawan terus. Enggak usah pedulikan demo-shaming macam begitu","1826859264184647716","","","in","","174","327","10226","https://x.com/undefined/status/1826859264184647716","1422951168",
"1750405979165114469","Thu Jan 25 06:31:21 +0000 2024","2940","Sejumlah ketua umum partai sekaligus menteri di kabinet Jokowi menggaungkan narasi bansos Pak Jokowi . Manuver tersebut rawan disalahgunakan untuk kepentingan elektoral. Para pemilih perlu memahami bahwa danabantuan sosial (bansos) bukan berasal dari saku presiden Jokowi https://t.co/jfNEb5QjrW","1750405979165114469","https://pbs.twimg.com/amplify_video_thumb/1750405805705445376/img/g0DS5hEfjnNhX6Pq.jpg","","in","","67","364","1711","https://x.com/undefined/status/1750405979165114469","18129942",
"1946366071705043034","Sat Jul 19 00:26:47 +0000 2025","3741","PEMERKOSAAN HUKUM UNTUK PENJARAKAN LAWAN POLITIK Tom Lembong dihukum 4 5 tahun dengan pertimbangan hukum yg sangat tidak masuk akal : 1) tidak ditemukan niat jahat (mensrea) 2) tidak menerima apapun 3) tidak ada kerugian negara 4) tidak ditemukan pelanggaran hukum. Artinya https://t.co/rfroeV1d4e","1946366071705043034","https://pbs.twimg.com/amplify_video_thumb/1946350340904771584/img/HUGOBNiX6PLk5FwL.jpg","","in","","36","243","1771","https://x.com/undefined/status/1946366071705043034","1117990249806721024",
"2057426445060964552","Thu May 21 11:41:04 +0000 2026","14812","Guys DPR baru saja mengusulkan sesuatu yang menurut gue paling sempurna menggambarkan betapa jauhnya jarak antara para wakil rakyat dengan kenyataan rakyat yang mereka wakili. Di tengah rupiah Rp17.700. Di tengah badai PHK yang mengintai. Di tengah guru honorer yang digaji https://t.co/sCWQHs7OwV","2057426445060964552","https://pbs.twimg.com/media/HI1xix2a4AAmghZ.jpg","","in","","891","947","7649","https://x.com/undefined/status/2057426445060964552","1772323119111487490",
"1795003530576793846","Mon May 27 08:06:05 +0000 2024","940","Pemerintah makin dikritik makin ada-ada aja","1795003530576793846","","","in","","5","30","120","https://x.com/undefined/status/1795003530576793846","1422951168",
"1354311705938063363","Wed Jan 27 06:14:07 +0000 2021","2117","Sony enggak kenal rem kali ya? Buset dah. A7s iii A7c sekarang A1. Sejauh ini spek terbaik ada di A1. 8K 10-bit 4:2:0 video. Harganya 6500 USD alias IDR 91 juta-an body only belum sama pajak. Wkwk. Dahlah pusing https://t.co/WMwe9eBGPb","1354311705938063363","https://pbs.twimg.com/media/Est7T6zXYAUa-nQ.jpg","","in","","45","99","79","https://x.com/undefined/status/1354311705938063363","1422951168",
"2073308328541773834","Sat Jul 04 07:30:00 +0000 2026","460","Kepada jaksa mantan Wakil Kepala Badan Gizi Nasional Sony Sonjaya mengungkap para pejabat dan politikus yang meminta jatah dapur makan bergizi gratis. Menyeret puluhan nama dan membongkar aneka modus korupsi proyek ini. https://t.co/iZ7KXSNNGg","2073308328541773834","https://pbs.twimg.com/media/HMWsaSGawAA15qy.jpg","","in","","6","44","215","https://x.com/undefined/status/2073308328541773834","18129942",
"1252079276318482433","Mon Apr 20 04:12:53 +0000 2020","165","@syagie_ Kabinet Jamet Berkarya","1252087819683627010","","","in","","1","7","2","https://x.com/undefined/status/1252087819683627010","1422951168",
