"conversation_id_str","created_at","favorite_count","full_text","id_str","image_url","in_reply_to_screen_name","lang","location","quote_count","reply_count","retweet_count","tweet_url","user_id_str","username"
"643608161711067136","Tue Sep 15 02:11:58 +0000 2015","56","Sebagai Perdana Menteri dan Presiden Barisan Nasional saya telah https://t.co/zkSEI5kLsz","643608161711067136","","","in","","0","37","43","https://x.com/undefined/status/643608161711067136","16389180",
"491606849574019073","Tue Jul 22 15:33:01 +0000 2014","190","Presiden &amp; para menteri terus ikuti perkembangan situasi proses rekapitulasi &amp; pengumuman hasil Pilpres oleh KPU. http://t.co/c66skVJSYw","491606849574019073","https://pbs.twimg.com/media/BtKJ0qJCAAEyqwU.jpg","","in","","0","317","836","https://x.com/undefined/status/491606849574019073","1307120064",
"451263892514013184","Wed Apr 02 07:44:30 +0000 2014","75","Presiden ingin masa kabinet yg tersisa 7 bulan lagi masalah listrik di Sumut dpt tuntas utk kurangi permasalahan pemerintahan mendatang.","451263892514013184","","","in","","0","83","293","https://x.com/undefined/status/451263892514013184","1307120064",
"510055915655938048","Thu Sep 11 13:23:01 +0000 2014","97","Pemerintah sdh lakukan penghematan dr thn ke thn. Pemotongan anggaran &amp; diantaranya gaji Presiden Wapres 10 th tdk naik utk selamatkan APBN","510055915655938048","","","in","","1","62","227","https://x.com/undefined/status/510055915655938048","1307120064",
"545274082397544448","Wed Dec 17 17:47:26 +0000 2014","127","Yang penting dgn sense of crisis yg dimiliki Presiden &amp; pemerintah segera menentukan solusi policy respons &amp; aksi nyata yg jitu. *SBY*","545274082397544448","","","in","","0","22","303","https://x.com/undefined/status/545274082397544448","1307120064",
"500444926295822336","Sat Aug 16 00:52:22 +0000 2014","168","Pidato Kenegaraan Presiden SBY di Hadapan Sidang Bersama DPR dan DPD link http://t.co/EbZYY8qWJi","500444926295822336","","","in","","0","74","365","https://x.com/undefined/status/500444926295822336","1307120064",
"511771880043208704","Tue Sep 16 07:01:39 +0000 2014","76","Tingkatkan hub bilateral &amp; kerjasama dgn Tiongkok Presiden SBY menerima Delegasi Wakil Ketua MPR RRT Wang Jiarui. http://t.co/HZz1cHpvwR","511771880043208704","https://pbs.twimg.com/media/Bxotzx4CAAAPiv5.jpg","","in","","0","12","115","https://x.com/undefined/status/511771880043208704","1307120064",
"419626317105999872","Sun Jan 05 00:28:04 +0000 2014","166","Presiden SBY: Saat krisis kalau ada yg harus kempes kantongnya biarlah yg agak kempes kantongnya pemerintah. Jgn kantong rakyat yg kosong","419626317105999872","","","in","","0","703","1196","https://x.com/undefined/status/419626317105999872","1307120064",
"518755605058572288","Sun Oct 05 13:32:28 +0000 2014","92","Presiden SBY harap pemerintah selanjutnya tuntaskan pembangunan kekuatan alutsista minimum AU yang sdh dimulai sejak th 2010 hingga 2018.","518755605058572288","","","in","","0","81","176","https://x.com/undefined/status/518755605058572288","1307120064",
"593302367845519360","Wed Apr 29 06:34:42 +0000 2015","150","Ketika menghadapi protes &amp; gempuran pertanyaan pers tidak mungkin saya berseberangan dgn negara pemerintah &amp; Presiden kita. *SBY*","593302367845519360","","","in","","0","27","227","https://x.com/undefined/status/593302367845519360","1307120064",
"513904273076133889","Mon Sep 22 04:15:01 +0000 2014","120","calon presiden 2019 (yang sipit sebelah kanan) dan calon menteri agamanya (yang kiri) hehehehe... http://t.co/uhEioZpWaN","513904273076133889","https://pbs.twimg.com/media/ByHBNlsCQAA2CTZ.jpg","","in","","0","143","249","https://x.com/undefined/status/513904273076133889","146623204",
"583232809701019648","Wed Apr 01 11:41:52 +0000 2015","110","Kala itu SBY meminta jajaran pemerintah pusat &amp; daerah utk beri dukungan sosialisasi amandemen UUD 1945 yg akan dilakukan tim MPR. #HISTAL","583232809701019648","","","in","","0","9","99","https://x.com/undefined/status/583232809701019648","1307120064",
"558911288592441344","Sat Jan 24 08:56:49 +0000 2015","73","Masalah itu datang ketika presiden sok2an kasi nama ke KPK utk calon menteri...manis di depan...jaksa agung dan kapolri? melengos","558911288592441344","","","in","","0","68","327","https://x.com/undefined/status/558911288592441344","200071462",
"613377613491363840","Tue Jun 23 16:06:33 +0000 2015","122","Artinya kalau 5 hal yg saya kritisi dulu juga tidak bisa dijawab oleh DPR &amp; Pemerintah sekarang dana aspirasi itu tetap tidak tepat. *SBY*","613377613491363840","","","in","","0","41","188","https://x.com/undefined/status/613377613491363840","1307120064",
"516605182688235521","Mon Sep 29 15:07:28 +0000 2014","51","18. Sebab Presiden baru tdk ikut membahas RUU tsb. Dengan demikian Presiden baru dapat mengembalikan RUU tsb ke DPR utk dibahas lagi","516605182688235521","","","in","","0","89","467","https://x.com/undefined/status/516605182688235521","434724503",
"346205784159424513","Sun Jun 16 10:01:05 +0000 2013","0","http://t.co/DIHyXfENTR Pengumuman kenaikan harga BBM Jakarta dikepung demo...","346205784159424513","","","in","","0","2","12","https://x.com/undefined/status/346205784159424513","106038219",
"468065303260192768","Sun May 18 16:27:19 +0000 2014","1","Menolak tawaran jutaan rupiah membuat jingle untuk mendukung salah seorang capres karena hatiku enggak mengizinkan itu rasanya campur aduk","468065303260192768","","","in","","0","1","13","https://x.com/undefined/status/468065303260192768","1422951168",
"486806110116904960","Wed Jul 09 09:36:35 +0000 2014","7","Saran ke Presiden Baru: Jangan Subsidi BBM-nya Tapi Orangnya http://t.co/akYJmOY4Zi via @detikfinance","486806110116904960","","","in","","0","3","66","https://x.com/undefined/status/486806110116904960","69183155",
"539585980303302656","Tue Dec 02 01:04:57 +0000 2014","40","Sudah ada Pimpinan DPR tandingan Gubernur DKI tandingan. Semua didiamkan. Bisa2 besok muncul Presiden tandingan waduh...","539585980303302656","","","in","","0","133","189","https://x.com/undefined/status/539585980303302656","434724503",
"491812247325265920","Wed Jul 23 05:09:11 +0000 2014","0","Kamu bisa aja @RHMLae: Siapapun yg jd presiden nanti tetep cuma bung FiersaBesari presiden dihati aku ","491812247325265920","","","in","","0","0","5","https://x.com/undefined/status/491812247325265920","1422951168",
"531015753542025216","Sat Nov 08 09:29:56 +0000 2014","60","Drpd komentari org blusukan lbh baik komentari org yg malas di kantor yg korupsi atau yg betengkar di DPR.","531015753542025216","","","in","","0","45","156","https://x.com/undefined/status/531015753542025216","94805910",
"533952682604494850","Sun Nov 16 12:00:14 +0000 2014","102","Kedua PD wajib mendukung kebijakan Presiden &amp; pemerintah yang tepat &amp; sungguh bermanfaat bagi rakyat. Tidak waton suloyo .","533952682604494850","","","in","","0","30","178","https://x.com/undefined/status/533952682604494850","1307120064",
"555169200746926080","Wed Jan 14 01:07:06 +0000 2015","93","Saya yakin Pak Jokowi juga akan lakukan hal yg sama. Mari kita dukung Presiden &amp; pemerintah utk laksanakan tugas penting ini. *SBY*","555169200746926080","","","in","","0","35","257","https://x.com/undefined/status/555169200746926080","1307120064",
"431989906915606530","Sat Feb 08 03:16:34 +0000 2014","84","Presiden &amp; Ibu Ani kunjungan kerja ke Bengkulu slm 3 hr utk tinjau infrastruktur pelabuhan program BPJS &amp; hadiri Hari Pers Nasional.","431989906915606530","","","in","","0","108","682","https://x.com/undefined/status/431989906915606530","1307120064",
"432152940002820096","Sat Feb 08 14:04:24 +0000 2014","62","Perlu sinergi &amp; kerjasama antara Pemerintah Pusat Pemerintah Daerah dan BPJS Kesehatan agar layanan baik &amp; merata. *SBY*","432152940002820096","","","in","","0","89","208","https://x.com/undefined/status/432152940002820096","1307120064",
"533952962276507648","Sun Nov 16 12:01:21 +0000 2014","122","Ketiga PD wajib mengkritisi dan menolak kebijakan Presiden &amp; Pemerintah yang tidak tepat dan nyata-nyata tidak pro rakyat.","533952962276507648","","","in","","0","45","236","https://x.com/undefined/status/533952962276507648","1307120064",
"545269269278105600","Wed Dec 17 17:28:19 +0000 2014","74","Saya setuju bhw subsidi yg tdk tepat harus kita pangkas Karenanya harga BBM saya naikkan th 2013 jg tarif listrik &amp; gas di th 2014. *SBY*","545269269278105600","","","in","","0","15","247","https://x.com/undefined/status/545269269278105600","1307120064",
"534648391033040896","Tue Nov 18 10:04:44 +0000 2014","71","yang paling untung harga BBM naik siapa? ya yang punya pom bensin asing | akhirnya investasinya maknyus harga minyaknya sekarang bersaing","534648391033040896","","","in","","0","19","723","https://x.com/undefined/status/534648391033040896","146623204",
"556339001397739520","Sat Jan 17 06:35:28 +0000 2015","51","1. Saya ingat betul perdebatan perumusan pasal ini DPR ketika saya mewakili Pemerintah membahas RUU Kepolisian http://t.co/lZkLAnWpnX","556339001397739520","https://pbs.twimg.com/media/B7iDX8SCUAEBHyC.png","","in","","0","26","252","https://x.com/undefined/status/556339001397739520","434724503",
"400911834225463296","Thu Nov 14 09:03:24 +0000 2013","70","@NajibRazak potong subsidi buat GST konon bantu negara hadapi defisit. Bila kita usul potong belanja menteri BN koyak usul &amp; halang bahas","400911834225463296","","NajibRazak","in","","0","12","271","https://x.com/undefined/status/400911834225463296","143520265",
"549053560470523905","Sun Dec 28 04:05:44 +0000 2014","47","Saya sarankan kpd pemerintah drpd pusing2 berhemat...buat aja rupiah jd Rp5000/dolar...langsung enak","549053560470523905","","","in","","0","86","146","https://x.com/undefined/status/549053560470523905","200071462",
"437960270909292545","Mon Feb 24 14:40:40 +0000 2014","5","Kamu kok nggak ngebales BBM aku sih? Aku bunuh diri nih :'( *lalu ganti nama jadi titik lalu nyilet tangan tapi update dulu. DRAMA!!!* -_-","437960270909292545","","","in","","0","5","77","https://x.com/undefined/status/437960270909292545","1422951168",
"538370774130638848","Fri Nov 28 16:36:09 +0000 2014","78","Malam ini masih bersama para Menteri Kabinet Kerja di kantor Wapres http://t.co/F74un1w98D","538370774130638848","https://pbs.twimg.com/media/B3itVr1CIAE8qCN.jpg","","in","","0","82","119","https://x.com/undefined/status/538370774130638848","903172238",
"474727695767461889","Fri Jun 06 01:41:17 +0000 2014","0","@sitikartikatika familiar? @infogunung #maujual jaket consina Imja-Tse - Rp. 245K BBM: 74D91237 WA: 08997826962 http://t.co/woQVSyIU0Q ","474727695767461889","","sitikartikatika","in","","0","0","1","https://x.com/undefined/status/474727695767461889","1422951168",
"392128973594836992","Mon Oct 21 03:23:27 +0000 2013","0","RT @TMCPoldaMetro: 10.15 Jl Gatot Subroto depan Gedung DPR/MPR RI mulai dialihkan krn ada kegiatan unras http://t.co/3l9V5Wy5Kk","392128973594836992","https://pbs.twimg.com/media/BXEd_xuCUAAOtK7.jpg","","in","","0","2","8","https://x.com/undefined/status/392128973594836992","106038219",
"392479430515642370","Tue Oct 22 02:36:02 +0000 2013","0","Bbm for Android installnya susah sekali -_-","392479430515642370","","","in","","0","2","22","https://x.com/undefined/status/392479430515642370","1422951168",
"443304472815869952","Tue Mar 11 08:36:37 +0000 2014","0","Hiatus dulu sejenak. Kamu mau bayarin? Asik RT @YoPs86: Bertualang lagi yok..Bali-Sumbawa-Flores :D tiket KA subsidi lg ni RT","443304472815869952","","","in","","0","0","0","https://x.com/undefined/status/443304472815869952","1422951168",
"534392913430446080","Mon Nov 17 17:09:33 +0000 2014","223","Huahahaha Presiden Jokowi naikkan harga bbm ketika harga minyak dunia sedang turun. Gejala apa nih ya?","534392913430446080","","","in","","0","511","1531","https://x.com/undefined/status/534392913430446080","434724503",
"563141764798619648","Thu Feb 05 01:07:14 +0000 2015","25","Bahwa sesungguhnya menteri yg berkata Menurut instruksi bpk presiden lbh mulia dibanding menteri yg berkata Presiden msh petugas partai ","563141764798619648","","","in","","0","37","163","https://x.com/undefined/status/563141764798619648","89418832",
"400975502892363776","Thu Nov 14 13:16:24 +0000 2013","0","Jokowi minta agar pajak kendaraan pribadi dinaikan http://t.co/UQTOVrv7dV","400975502892363776","","","in","","0","5","14","https://x.com/undefined/status/400975502892363776","106038219",
"443534213305081857","Tue Mar 11 23:49:31 +0000 2014","1","Ini perasaanku doang atau hampir semua aplikasi ganti desain jadi minimalis? Mulai dari Windows 8 Twitter Line BBM Instagram dll","443534213305081857","","","in","","0","0","14","https://x.com/undefined/status/443534213305081857","1422951168",
"500195420652331008","Fri Aug 15 08:20:56 +0000 2014","78","Sidang Paripurna DPR/DPD RI Presiden sampaikan Pidato Kenegaraan ttg transformasi Indonesia setelah 69 th merdeka. http://t.co/2aKz0jUqRT","500195420652331008","https://pbs.twimg.com/media/BvENEujCAAAMPcF.jpg","","in","","0","21","267","https://x.com/undefined/status/500195420652331008","1307120064",
"409839975442558976","Mon Dec 09 00:20:39 +0000 2013","111","Presiden SBY: Pemberantasan korupsi hrs dilanjutkan scr intensif &amp; agresif. Mari jadikan tugas bersama. Selamat Hari Anti Korupsi Sedunia!","409839975442558976","","","in","","0","248","1160","https://x.com/undefined/status/409839975442558976","1307120064",
"393893829880729600","Sat Oct 26 00:16:21 +0000 2013","160","Presiden SBY: Kemajuan sebuah bangsa adalah hasil persatuan dan kerja keras seluruh rakyat bukan kerja pemerintah belaka.","393893829880729600","","","in","","0","337","972","https://x.com/undefined/status/393893829880729600","1307120064",
"451365946842558465","Wed Apr 02 14:30:02 +0000 2014","128","Presiden luncurkan Beasiswa Presiden RI di Istana Negara diberikan pd WNI utk menempuh S2 &amp; S3 di sejumlah perguruan tinggi terbaik dunia.","451365946842558465","","","in","","0","131","832","https://x.com/undefined/status/451365946842558465","1307120064",
"512510823206383618","Thu Sep 18 07:57:56 +0000 2014","73","Terakhir Presiden SBY akan ke Jepang utk tuntaskan tugas peningkatan kerjasama Jepang-RI &amp; buka jalan kerjasama utk pemerintah mendatang.","512510823206383618","","","in","","0","54","134","https://x.com/undefined/status/512510823206383618","1307120064",
"526328874099933184","Sun Oct 26 11:05:56 +0000 2014","168","Selamat Untuk Presiden RI Bapak Jokowi dan Wapres RI yang telah Mengumumkan Kabinet Kerjanya Mari Kita Dukung terusss http://t.co/hcmGUskbrT","526328874099933184","https://pbs.twimg.com/media/B03lMN4CYAAh-lb.jpg","","in","","1","50","78","https://x.com/undefined/status/526328874099933184","219244515",
"510056132174286849","Thu Sep 11 13:23:52 +0000 2014","81","Transisi harus terus dijalankan. Jadi kewajiban moral saya &amp; pemerintah utk bantu Presiden terpilih agar lebih siap emban tugas &amp; tantangan.","510056132174286849","","","in","","0","27","150","https://x.com/undefined/status/510056132174286849","1307120064",
"534345300320591873","Mon Nov 17 14:00:21 +0000 2014","20","Karena fakta inilah saya termasuk pendukung tarik subsidi dari pemilik mobil via pajak. Agar yg miskin tdk terdampak http://t.co/ATZprH4S8p","534345300320591873","https://pbs.twimg.com/media/B2pgNz2CQAAvRP7.png","","in","","0","8","170","https://x.com/undefined/status/534345300320591873","159919812",
"534647486497816576","Tue Nov 18 10:01:08 +0000 2014","84","dulu logika pemerintah naikin BBM karena harga minyak dunia naik | harganya turun tetep aja dinaikin alasan lagi udah niat itu mah :)","534647486497816576","","","in","","0","62","901","https://x.com/undefined/status/534647486497816576","146623204",
"551973875316039680","Mon Jan 05 05:30:01 +0000 2015","12","Tidak lagi di subsidi tapi pemerintah masih tentukan harga bensin http://t.co/BvUy2WhNfa @majalah_detik http://t.co/hdRFl2suDu","551973875316039680","https://pbs.twimg.com/media/B6kBUKQCcAI6Rgx.jpg","","in","","0","5","31","https://x.com/undefined/status/551973875316039680","69183155",
"271527197062332416","Thu Nov 22 08:15:03 +0000 2012","0","Berikut rute pengalihan arus akibat demo http://t.co/5Ad1q8P7","271527197062332416","","","in","","0","1","7","https://x.com/undefined/status/271527197062332416","106038219",
"468986951383916545","Wed May 21 05:29:37 +0000 2014","0","ada demo serikat pekerja TKI di bundaran HI... lalulintas padat merayap. http://t.co/Mqb91df5bN via @agung_bharata","468986951383916545","","","in","","0","0","10","https://x.com/undefined/status/468986951383916545","106038219",
"511046891577286656","Sun Sep 14 07:00:48 +0000 2014","1","Pemilik Windows Phone sekarang sudah bisa menggunakan BBM #JktTekno http://t.co/sHAGxBRx6t","511046891577286656","","","in","","0","0","11","https://x.com/undefined/status/511046891577286656","106038219",
"495318902126018560","Fri Aug 01 21:23:23 +0000 2014","39","Ini Usulan Nama-nama Menteri untuk Kabinet Jokowi-JK http://t.co/vJzUzNmQVc","495318902126018560","","","in","","0","19","92","https://x.com/undefined/status/495318902126018560","69183155",
"517114207649923072","Wed Oct 01 00:50:09 +0000 2014","1","Desain Materai 2014 Oleh Dirjen Pajak #JktNews http://t.co/1Yd9LjqydI","517114207649923072","","","in","","0","0","2","https://x.com/undefined/status/517114207649923072","106038219",
"392859204287209472","Wed Oct 23 03:45:07 +0000 2013","0","Penghasilan Pengemis di Jakarta Capai Ratusan Ribu Rupiah Per-hari http://t.co/09IozlgEMR","392859204287209472","","","in","","0","7","29","https://x.com/undefined/status/392859204287209472","106038219",
"271107486545752065","Wed Nov 21 04:27:16 +0000 2012","1","#jktdemo #jktlivereport RT @novence: #11:11 macet ada demo di Bundaran HI. http://t.co/WomBHN4H","271107486545752065","","","in","","0","6","21","https://x.com/undefined/status/271107486545752065","106038219",
"477707189050957825","Sat Jun 14 07:00:43 +0000 2014","2","Fitur find friend BBM android tidak lagi memerlukan PIN #JktTekno http://t.co/g9xLKH57Kp","477707189050957825","","","in","","0","1","8","https://x.com/undefined/status/477707189050957825","106038219",
"467289962019176448","Fri May 16 13:06:23 +0000 2014","0","Fak :)) @DudeSzantos: Ayo beli Tempat Aku Pulang . Gak jual di KFC ato pom bensin. Ini cara pemesanannya! Thanks.. http://t.co/GTKxmASnj0 ","467289962019176448","https://pbs.twimg.com/media/BnwSvqXIcAAkSRI.jpg","","in","","0","0","4","https://x.com/undefined/status/467289962019176448","1422951168",
"392632776069246976","Tue Oct 22 12:45:23 +0000 2013","5","5 fitur andalan yang ditawarkan BBM untuk Android dan iPhone http://t.co/fnmpg3WiBl","392632776069246976","","","in","","0","3","18","https://x.com/undefined/status/392632776069246976","106038219",
"446647401856516096","Thu Mar 20 14:00:13 +0000 2014","75","Presiden beri dukungan &amp; apresiasi pd jajaran Kemenkeu &amp; Dirjen Pajak yg gunakan metodologi e-filing utk memudahkan wajib pajak.","446647401856516096","","","in","","0","40","266","https://x.com/undefined/status/446647401856516096","1307120064",
"520464220073123840","Fri Oct 10 06:41:54 +0000 2014","58","Diisukan bhw MPR tidak akan melantik Presiden terpilih @jokowi_do2 dgn cara dibuat tidak kuorum . Jadi tidak memenuhi syarat. *SBY*","520464220073123840","","","in","","0","51","238","https://x.com/undefined/status/520464220073123840","1307120064",
"461438791274618880","Wed Apr 30 09:35:55 +0000 2014","89"," Jk ada hal yg tdk berkenan ini adl tugas negara semua utk rakyat saya mohon maaf. Saya harap pemerintah nanti makin maju ujar Presiden","461438791274618880","","","in","","0","134","402","https://x.com/undefined/status/461438791274618880","1307120064",
"507329776323796992","Thu Sep 04 00:50:19 +0000 2014","77","Presiden dianugerahi tanda jasa First Class Order of Temasek oleh pemerintah Singapura krn berkontribusi majukan hub bilateral kedua negara.","507329776323796992","","","in","","0","34","279","https://x.com/undefined/status/507329776323796992","1307120064",
"390628678566436864","Thu Oct 17 00:01:49 +0000 2013","104","Presiden SBY: Korupsi diberantas untuk selamatkan masa depan kita termasuk selamatkan pembangunan ekonomi nasional.","390628678566436864","","","in","","0","363","711","https://x.com/undefined/status/390628678566436864","1307120064",
"512164270637711360","Wed Sep 17 09:00:52 +0000 2014","60","Didampingi Wapres Boediono Presiden SBY memimpin rapat untuk memperbaiki UU Pemerintah Daerah yang lebih tepat dan efektif.","512164270637711360","","","in","","0","28","102","https://x.com/undefined/status/512164270637711360","1307120064",
"392259355392741377","Mon Oct 21 12:01:32 +0000 2013","37","Presiden SBY: Sy perintahkan Menko Kesra Menkes Men BUMN &amp; Dirut PT ASKES utk sukseskan operasionalisasi BPJS Kesehatan pd 1 Januari 2014.","392259355392741377","","","in","","0","69","330","https://x.com/undefined/status/392259355392741377","1307120064",
"518942287154278400","Mon Oct 06 01:54:17 +0000 2014","41","PD bersedia bersama2 di DPR &amp; MPR jika KMP mendukung Perpu Pilkada Langsung dgn Perbaikan yg akan saya terbitkan. *SBY*","518942287154278400","","","in","","0","51","160","https://x.com/undefined/status/518942287154278400","1307120064",
"518943574063194113","Mon Oct 06 01:59:24 +0000 2014","54","Sekitar pkl 20.00 saya terima lembar kesepakatan utk (1) Kebersamaan di DPR &amp; MPR; (2) Dukung Perpu Pilkada Langsung dgn perbaikan. *SBY*","518943574063194113","","","in","","0","42","198","https://x.com/undefined/status/518943574063194113","1307120064",
"405229749468815360","Tue Nov 26 07:01:15 +0000 2013","161","Presiden SBY mempelajari kembali surat balasan dari PM Abbot untuk bahan rapat kabinet terbatas pk. 3 sore ini. http://t.co/fZjKEzYXiJ","405229749468815360","https://pbs.twimg.com/media/BZ-qT1uCQAAoS_6.jpg","","in","","0","189","491","https://x.com/undefined/status/405229749468815360","1307120064",
"518681115893067776","Sun Oct 05 08:36:29 +0000 2014","51","Tgl 1 Oktober 2014 setelah menghadiri Pelantikan Anggota DPR DPD &amp; MPR Pak JK sahabat saya temui saya di Gedung DPR. *SBY*","518681115893067776","","","in","","0","26","212","https://x.com/undefined/status/518681115893067776","1307120064",
"435430369039368192","Mon Feb 17 15:07:44 +0000 2014","91","Presiden SBY kpd para pengungsi: Masyarakat dimohon sabar pemerintah akan beri pelayanan baik rumah rusak akan kita bantu.","435430369039368192","","","in","","0","92","374","https://x.com/undefined/status/435430369039368192","1307120064",
"407408506476580864","Mon Dec 02 07:18:51 +0000 2013","85","Utk tingkatkan daya tahan ekonomi Presiden &amp; anggota Kabinet bahas tata kelola ekonomi Indonesia di Istana Cipanas. http://t.co/YaddbzEgAN","407408506476580864","https://pbs.twimg.com/media/Badn4MHCYAEasKZ.jpg","","in","","0","63","269","https://x.com/undefined/status/407408506476580864","1307120064",
"473385596514086912","Mon Jun 02 08:48:15 +0000 2014","45","Usai hadiri sidang MPR nantinya Presiden SBY akan sambut Presiden baru di Istana &amp; terima penghormatan bagi incoming &amp; outgoing leader.","473385596514086912","","","in","","0","34","140","https://x.com/undefined/status/473385596514086912","1307120064",
"510054075551854592","Thu Sep 11 13:15:42 +0000 2014","35","Dalam rapat terbatas kabinet Presiden SBY jelaskan 7 kebijakan &amp; instruksi Presiden berkaitan dg transisi kepemimpinan ke Presiden terpilih","510054075551854592","","","in","","0","10","86","https://x.com/undefined/status/510054075551854592","1307120064",
"520465820342697985","Fri Oct 10 06:48:16 +0000 2014","83","Saya mengalah &amp; berpidato di Istana Negara. Ada yg bilang MPR ditekan oleh pihak tertentu utk tidak membolehkan Presiden berpidato. *SBY*","520465820342697985","","","in","","0","27","247","https://x.com/undefined/status/520465820342697985","1307120064",
"511332931730542593","Mon Sep 15 01:57:25 +0000 2014","47","Siapkan tindakan proaktif hari Minggu sore Presiden SBY memimpin rapat kabinet menanggapi isu gerakan Negara Islam Irak &amp; Suriah (ISIS).","511332931730542593","","","in","","0","27","132","https://x.com/undefined/status/511332931730542593","1307120064",
"515136411616296960","Thu Sep 25 13:51:05 +0000 2014","55","Pd KTT Kemitraan Pemerintah Terbuka (OGP) Presiden SBY beri sambutan pembuka dilanjutkan Presiden Obama &amp; Presiden Meksiko Enrique P Nieto","515136411616296960","","","in","","0","13","88","https://x.com/undefined/status/515136411616296960","1307120064",
"423665231869403136","Thu Jan 16 03:57:17 +0000 2014","65","Presiden SBY pimpin sidang kabinet paripurna bahas pengelolaan ekonomi bantuan bencana dan kesiapan Pemilu. http://t.co/aViHW8aRE9","423665231869403136","https://pbs.twimg.com/media/BeEpSJnCAAAFUHk.jpg","","in","","0","42","190","https://x.com/undefined/status/423665231869403136","1307120064",
"534156463736774656","Mon Nov 17 01:29:59 +0000 2014","18","Disaat harga minyak dunia turun smoga Presiden Jokowi saat diLuarNegri dapat masukn penting unt tak naikkn harga BBM&amp;Subsidi tepat sasaran.","534156463736774656","","","in","","0","22","67","https://x.com/undefined/status/534156463736774656","86012022",
"407408674223575040","Mon Dec 02 07:19:31 +0000 2013","76","Presiden terus ikuti pergerakan rupiah. Langkah pemulihan ekonomi dievaluasi agar daya tahan ekonomi makin kuat. http://t.co/ngBb9LvDhV","407408674223575040","https://pbs.twimg.com/media/BadoB9ICIAAtu7G.jpg","","in","","0","124","242","https://x.com/undefined/status/407408674223575040","1307120064",
"510053544733315073","Thu Sep 11 13:13:36 +0000 2014","35","Presiden SBY memimpin rapat terbatas kabinet bidang perekonomian &amp; membahas sejumlah isu publik yg tengah berkembang.","510053544733315073","","","in","","0","14","87","https://x.com/undefined/status/510053544733315073","1307120064",
