"conversation_id_str","created_at","favorite_count","full_text","id_str","image_url","in_reply_to_screen_name","lang","location","quote_count","reply_count","retweet_count","tweet_url","user_id_str","username"
"1385075832641650691","Thu Apr 22 03:39:46 +0000 2021","2408","Nama politikus PDIP Herman Hery hilang dari surat dakwaan eks Menteri Sosial Juliari Batubara. Padahal namanya sempat terseret dalam kasus perkara dugaan korupsi pengadaan bantuan sosial atau bansos Covid-19. #TempoNasional https://t.co/P1iYlp5ILH","1385075832641650691","","","in","","209","363","1036","https://x.com/undefined/status/1385075832641650691","18129942",
"1261667792014602241","Sat May 16 14:40:16 +0000 2020","6463","Daripada naikin BPJS mending jokowi bubarin BPIP KSP Stafsus presiden &amp; wapres mereka gak ada gunanya serta hemat triliunan rupiah Yang setuju silahkan retweet","1261667792014602241","","","in","","167","156","4076","https://x.com/undefined/status/1261667792014602241","1006827831995711488",
"1187264208477442048","Thu Oct 24 07:07:00 +0000 2019","13222","Sidang Kabinet Paripurna pertama Kabinet Indonesia Maju. Saya kembali menegaskan lagi bahwa tidak ada visi-misi menteri yang ada hanya visi-misi presiden dan wapres. Semua yang telah diputuskan dalam rapat harus dilaksanakan tidak lagi diperdebatkan di luar. https://t.co/lRJgS8oBP0","1187264208477442048","https://pbs.twimg.com/media/EHoCf-hVAAEpO6y.jpg","","in","","147","392","1797","https://x.com/undefined/status/1187264208477442048","366987179",
"1340492511333085189","Sun Dec 20 03:01:34 +0000 2020","3834","Menteri Juliari Batubara membentuk tim khusus untuk menunjuk langsung vendor serta menampung upeti dan mengarahkan vendor kepada supplier yang terafiliasi dengan PDIP. Nama putra Presiden sempat disebut untuk pengadaan tas penampung bansos. #MajalahTempo https://t.co/s9vcYO5ko3","1340492511333085189","","","in","","344","341","1575","https://x.com/undefined/status/1340492511333085189","18129942",
"1169258696653697024","Wed Sep 04 14:39:31 +0000 2019","1434","Beasiswa itu dari pajak kita semua. Anda yang menerima beasiswa di dalam atau luar negeri TIDAK berhutang apapun pada pemerintah birokrasi apalagi rezim yang berkuasa. Hutang terbesar pada rakyat. Maka tak ada kontradiksi apapun jika Anda berbeda pendapat dengan kekuasaan.","1169258696653697024","","","in","","56","61","797","https://x.com/undefined/status/1169258696653697024","159919812",
"889783083121037312","Tue Jul 25 09:43:13 +0000 2017","234","a. Yg di Jawa bensin naik 500 ato 1000 rupiah aja demonya 3 bulan b. Dulu subsidi 340 T gpp mosok yg 800 M dipermasalahin https://t.co/saWyHdUVnQ","889783083121037312","https://pbs.twimg.com/ext_tw_video_thumb/889779115397480448/pu/img/ELbPXZZ2tuQ9aMN_.jpg","","in","","21","26","279","https://x.com/undefined/status/889783083121037312","363128593",
"962864455867547648","Mon Feb 12 01:42:30 +0000 2018","2076","Kok bisa jd menteri keuangan terbaik ketika target tak ada yg tercapai (pertumbuhan n pajak) subsidi dicabuti impor naik utang melonjak.","962864455867547648","","","in","","675","2479","855","https://x.com/undefined/status/962864455867547648","79139422",
"1106704031047540738","Fri Mar 15 23:49:37 +0000 2019","1613","Dalam sejarah pemberantasan korupsi baru ini ada menteri yang ditangkap karena jual beli jabatan. INI pertanda buruknya manajemen pemerintahan. Mekanisme kabinet malam lebih berkuasa ketimbang kabinet sesungguhnya.","1106704031047540738","","","in","","117","566","410","https://x.com/undefined/status/1106704031047540738","3252997136",
"1147457536527753216","Sat Jul 06 10:49:30 +0000 2019","1358","Pajak Kapal Pesiar Rumah Mobil dan Motor Mewah diturunin. Giliran iuran BPJS BBM TDL sampe STNK motor bututpun dinaikin. Pro rakyat? Ndasmu! https://t.co/yajyjbBP1T","1147457536527753216","","","in","","60","92","856","https://x.com/undefined/status/1147457536527753216","465415972",
"1261986112270000128","Sun May 17 11:45:10 +0000 2020","2730","Ketua DPR dan BPIP bikin konser narik sumbangan rakyat. Sebelumnya Ketua MPR bikin platform donasi via HP dan Menteri Keuangan buka rekening sumbangan. Ini negara atau yayasan sih? Tugas utama membuat kebijakan publik yang benar untuk menangani wabah justru diabaikan.","1261986112270000128","","","in","","94","113","1463","https://x.com/undefined/status/1261986112270000128","336088756",
"1266849994968952832","Sat May 30 21:52:30 +0000 2020","2391","Sekarang ini marwah @DPR_RI benar2 dipertaruhkan sdh 2 kali kesepakatan dpr dengan pihak pemerintah tidak ditaati pemerintah jelas melanggar UU MD3 tp tdk berdaya. 1. Kesepakatan tarif BPJS @KomisiIX 2. Proses seleksi Direksi TVRI. Dimana posisi DPR membela kepentingan rakyat?","1266849994968952832","","","in","","67","282","804","https://x.com/undefined/status/1266849994968952832","208784759",
"1354239865718714368","Wed Jan 27 01:28:39 +0000 2021","1304","Covid 1 Juta Kasus Korupsi Jiwasraya perkiraan 30 T Korupsi Asabri 17 T Korupsi BPJS 43 T Korupsi Bansos lebih 3.9 T Korupsi kementrian KKP Korupsi PT DI Kasus Suap KPU Kasus Suap Kemenpora Kasus Korupsi PLTU Riau Kasus suap duo Jendral Polisi @jokowi","1354239865718714368","","","in","","38","84","391","https://x.com/undefined/status/1354239865718714368","1182582278",
"1340242092304449537","Sat Dec 19 10:26:29 +0000 2020","1473","Ketua DPR/Puan M;agar wacana masa jabatan Presiden 3 periode dikaji di komisi II DPR.Tapi baiknya DPR focus hadirkan UU yg benar2 berkwalitas dan dihajatkan Negara/Rakyat. Soal masajabatan Presiden 3 periode sudah ditolak keras olh @jokowi. Dan masa jabatan Presiden domain MPR. https://t.co/qSTy9uO7EJ","1340242092304449537","https://pbs.twimg.com/media/Epl_E07UYAAOGA0.jpg","","in","","58","251","340","https://x.com/undefined/status/1340242092304449537","86012022",
"1179782120857726976","Thu Oct 03 15:35:51 +0000 2019","25972","Ketua DPR sudah terpilih. Ketua DPD sudah terpilih. Presiden sedikit lagi dilantik. Ketua MPR hari ini baru aja terpilih. Kemarin baru kena shock terapy basic aja kita kita yg muda. Dan kita kudu waspada dgn negara dalam 5 tahun ke depan. Kenapa? Simak threadnya di bawah ini.","1179782120857726976","","","in","","737","381","17529","https://x.com/undefined/status/1179782120857726976","499262326",
"1251851178343723008","Sun Apr 19 12:32:33 +0000 2020","2729","Sangat lucu ada pernyataan Menteri bhw penurunan harga BBM blm perlu walau harga minyak dunia sdh turun. Mekanisme harga BBM : 1. BBM nonsubsidi hanya oleh @pertamina 2. BBM subsidi (premium solar dan minyak tanah tertentu) oleh Menteri ESDM","1251851178343723008","","","in","","51","208","936","https://x.com/undefined/status/1251851178343723008","1117990249806721024",
"1292633835536920581","Mon Aug 10 01:28:17 +0000 2020","6032","Setuju imbauan Bpk Presiden agar beli produk dlm negeri utk bangkitkan ekonomi. Syaratnya rkyt hrs punya uang. Cara : 1) brkn lapangan kerja ke rakyat - bkn ke TKA 2) berikan uang tunai lewat BLT 3) kurangi pengeluaran rkyt dg turunkan BBM tarif listrik dan BPJS.","1292633835536920581","","","in","","92","340","1632","https://x.com/undefined/status/1292633835536920581","1117990249806721024",
"1354420791241129994","Wed Jan 27 13:27:35 +0000 2021","1545","Jika negara tdk ada duit sebaiknya sita harta koruptor Jiwasraya Asabri BPJS Bansos dan harta koruptor lainnya yg bernilai trilyunan rupiah itu. https://t.co/Pnmqd3i306","1354420791241129994","","","in","","43","106","498","https://x.com/undefined/status/1354420791241129994","1314102300718161920",
"1249701050212204545","Mon Apr 13 14:08:43 +0000 2020","5325","Cara sederhan menghitung harga BBM. Ada 13 variabel yg menentukan harga BBM - tapi hanya 3 yg utama yaitu harga minyak dunia kurs rupiah dan besaran subsidi. Harga minyak dunia sdh turun sktr 50 % kurs melemah sktr 15 %. Artinya harga BBM bisa turun sbsr 35 %.","1249701050212204545","","","in","","91","377","1797","https://x.com/undefined/status/1249701050212204545","1117990249806721024",
"1255499720853721091","Wed Apr 29 14:10:34 +0000 2020","2017","SBY 10th gak pernah telat tiap bulan kasih BLT gak pernah tuh pamer Bantuan Presiden SBY 10th kasih subsidi BBM gak pernah tuh bangga2in Subsidi Presiden Segitunya pak Jokowi butuh pengakuan https://t.co/QTbMDwxq3J","1255499720853721091","","","in","","64","250","766","https://x.com/undefined/status/1255499720853721091","1006827831995711488",
"444102871156416512","Thu Mar 13 13:29:10 +0000 2014","1","Cooking Demo by Chef Ragil at @FatahillahFood Fest 2014 #jktevent #jktlivetweet @Jkt_kotatua http://t.co/G3U7X2oU5f","444102871156416512","https://pbs.twimg.com/media/BinFNVICEAACJpX.jpg","","en","","0","1","7","https://x.com/undefined/status/444102871156416512","106038219",
"1352536769137410050","Fri Jan 22 08:41:09 +0000 2021","1494","HNW Dorong Pembentukan Perpres Tentang Ekstremisme Korupsi ( spt Jiwasraya Asabri BPJS TK Bansos) https://t.co/DXrUzA5qCe","1352536769137410050","","","in","","16","55","399","https://x.com/undefined/status/1352536769137410050","86012022",
"1340879623173722115","Mon Dec 21 04:39:49 +0000 2020","10402","Dua hari sebelum diterungku di rumah tahanan Komisi Pemberantasan Korupsi Menteri Sosial Juliari Peter Batubara menghadap Presiden Joko Widodo di Istana Bogor Jumat pagi 4 Desember lalu. #MajalahTempo https://t.co/0aC38qhePX https://t.co/B4EUlm3Lzi","1340879623173722115","https://pbs.twimg.com/media/EpvCoWHUUAARfG-.jpg","","in","","685","687","4089","https://x.com/undefined/status/1340879623173722115","18129942",
"1335155291613061121","Sat Dec 05 09:33:22 +0000 2020","4314","Pemerintah mendukung langkah2 KPK menangkap dan memburu para koruptor di institusi2 Pemerintah termasuk di KKP Kemensos OTT Pemda dll. Sejak awal Presiden sdh meminta agar KPK kejagung dan POLRI tdk rikuh memerangi korupsi asalkan benar dan profesional. Bravo KPK🇲🇨🇲🇨","1335155291613061121","","","in","","180","1069","348","https://x.com/undefined/status/1335155291613061121","282006208",
"1243151133297635329","Thu Mar 26 12:21:41 +0000 2020","2287","Kalo Presiden Wapres Menteri Kapolri Panglima TNI Jaksa Agung BPIP KSP Wantimpres Stafsus Bos BUMN Anggota DPR gak terima gaji sebulan aja gak mungkin langsung jatuh miskin kan?? NGUMPULIN DONASI DARI RAKYAT!! RAKYAT UDAH SUSAH WOYYYY!! BBM GAK TURUN-TURUN!!","1243151133297635329","","","in","","42","121","843","https://x.com/undefined/status/1243151133297635329","1006827831995711488",
"553798420595736577","Sat Jan 10 06:20:07 +0000 2015","1","Perlajanan BBM di Windows Phone #JktTekno http://t.co/rz3wWFKVTK","553798420595736577","","","in","","0","0","2","https://x.com/undefined/status/553798420595736577","106038219",
"1283622085521096705","Thu Jul 16 04:38:48 +0000 2020","2024","Bapak Presiden yth saran saya mari kita fokus tingkatkan daya beli rakyat dg cara ISI DOMPET RAKYAY dg ubah bantuan jadi uang tunai program padat karya dll serta turunkan BBM listrik BPJS biaya sekolah dll. Jika daya beli naik maka rakyat bisa beli produk UMKM","1283622085521096705","","","in","","28","147","518","https://x.com/undefined/status/1283622085521096705","1117990249806721024",
"539819027968057349","Tue Dec 02 16:31:00 +0000 2014","3","BBM Naik Tarif Baru Angkutan Umum Diberlakukan #JktNews http://t.co/DvKQZgSqEs","539819027968057349","","","in","","0","2","6","https://x.com/undefined/status/539819027968057349","106038219",
"1218373208107180035","Sat Jan 18 03:23:03 +0000 2020","3921","Coba tanya pada nurani anda ketika pemerintah cabut subsidi listrik dan gas 3 kg sehingga ada kenaikan harga Disisi lain pemerintah beri subsidi ke orang kaya berupa suntikan triliunan rupiah ke pengusaha sawit Nerima ngga sik?","1218373208107180035","","","in","","112","399","1601","https://x.com/undefined/status/1218373208107180035","1022118634079047680",
"1256683317593702401","Sat May 02 20:33:45 +0000 2020","3020","Viral masyrkt minang menghimbau Presiden RI Jokowi mundur scr terhormat dr jabatannya. DPR MPR dan Tokoh diminta utk pertimbangankan sebagai solusi selamatkan Bangat !!!... https://t.co/z8Kat5wa03","1256683317593702401","https://pbs.twimg.com/ext_tw_video_thumb/1256682704688394240/pu/img/7CdgqNiI4wXRZw9D.jpg","","in","","82","158","1096","https://x.com/undefined/status/1256683317593702401","159430790",
"1228036382230073344","Thu Feb 13 19:21:03 +0000 2020","1897","Saat hutang &amp; riba kotori otakku. Keinginan2 ga penting muncul. Untung aku bukan Presiden kalau tdk gara2 hutang aku ingin motong dana pensiun cabut subsidi gas bpjs bangun itu ini. Kalau kurang ngutang lagi.Tapi @Raniper62240863 papa ga ingin kawin lagi kok yang!! Sue...er https://t.co/0mlrjBgcDV","1228036382230073344","https://pbs.twimg.com/ext_tw_video_thumb/1228036210750193667/pu/img/Sb9mlJF1zNA8SI6s.jpg","","in","","26","89","435","https://x.com/undefined/status/1228036382230073344","572963346",
"1180044891939901440","Fri Oct 04 09:00:01 +0000 2019","1144","Komposisi pimpinan DPR dan MPR 2019-2024 yang mayoritas diisi oleh partai koalisi pendukung Presiden Jokowi berpotensi membuat kedua lembaga itu tidak kritis ke pemerintah. Harapan satu-satunya adalah oposisi jalanan: masyarakat sipil. https://t.co/RQhbOxaDTt","1180044891939901440","","","in","","57","65","784","https://x.com/undefined/status/1180044891939901440","4187275698",
"1251865640060641280","Sun Apr 19 13:30:01 +0000 2020","1048","Jangan ngeles Bu Dirut. Harga BBM non subsidi itu kewenangan Direksi @pertamina. Kalau yg subsidi adalah kewenangan Menteri ESDM atas usulan Direksi @pertamina","1251865640060641280","","","in","","22","59","489","https://x.com/undefined/status/1251865640060641280","1117990249806721024",
"1268401102916968449","Thu Jun 04 04:36:03 +0000 2020","3087","Raeni dapat privilege : perhatian presiden. foto itu viral SBY manggil ke istana nyuruh menteri pendidikan kasih beasiswa langsung keterima. Presidential Scholarship. Raeni at least ga perlu apply seleksi.","1268401102916968449","","","in","","97","84","1617","https://x.com/undefined/status/1268401102916968449","89326335",
"1344955120082042883","Fri Jan 01 10:34:23 +0000 2021","1929","Ormas FPI banyak merugikan keuangan negara bahkan sampai ratusan Triliunan rupiah berbeda dgn oknum² polisi dan oknum² partai politik yg tdk pernah sama sekali korupsi apa lagi merugikan keuangan Negara Jangankan korupsi nyolong duit Bansos aja gak pernah.","1344955120082042883","","","in","","25","90","356","https://x.com/undefined/status/1344955120082042883","1182582278",
"1204066172863279104","Mon Dec 09 15:52:00 +0000 2019","7701","Banyak yang minta versi lebih panjang dari acara pentas seni Prestasi Tanpa Korupsi yang diperankan oleh 3 Menteri kabinet Indonesia Maju. Nih.. Part 1 https://t.co/TSFjBMTezE","1204066172863279104","https://pbs.twimg.com/ext_tw_video_thumb/1204065942138834944/pu/img/GSdL9egwkiILDseX.jpg","","in","","343","131","4498","https://x.com/undefined/status/1204066172863279104","333923119",
"433163840130674688","Tue Feb 11 09:01:21 +0000 2014","4","Cukup dengan fitur ini tak perlu pin lagi untuk tambah teman di BBM Android/iOS http://t.co/b3brCK7vKw","433163840130674688","","","in","","0","0","8","https://x.com/undefined/status/433163840130674688","106038219",
"1178829424667418624","Tue Oct 01 00:30:11 +0000 2019","5489","DPR 2014-2019 meninggalkan segudang masalah legislasi korupsi hingga anggaran besar tanpa prestasi. Orang-orang akan selalu mengingat ini: penghujung masa kerja mereka diwarnai satu minggu penuh demo oleh mahasiswa dan elemen masyarakat lain. https://t.co/J5BTqeN7Ec","1178829424667418624","","","in","","235","119","6330","https://x.com/undefined/status/1178829424667418624","4187275698",
"525907119602532352","Sat Oct 25 07:10:02 +0000 2014","4","PR lingkungan u/ Presiden ke-7 hrs dibantu rakyat. Yuk gabung di wadah jurnalisme warga http://t.co/kWzBhQedy9 #PRke7 http://t.co/UfHSJyXEOm","525907119602532352","https://pbs.twimg.com/media/B0s7RrACUAEi95E.jpg","","in","","0","1","10","https://x.com/undefined/status/525907119602532352","106038219",
"1246639167615852544","Sun Apr 05 03:21:53 +0000 2020","2176","Menko Polhukam Mahfud MD menegaskan usulan pembebasan narapidana kasus korupsi bukan dari pemerintah. Menurutnya Menteri Hukum dan HAM Yasonna Laoly hanya menyampaikan usulan masyarakat. https://t.co/u0azlL7PCS","1246639167615852544","","","in","","2442","2642","812","https://x.com/undefined/status/1246639167615852544","4187275698",
"1101773066625929216","Sat Mar 02 09:15:43 +0000 2019","1984","Sebaiknya presiden pakai uang yang ada untuk bangunkan rumah korban gempa (Lombok Sumbawa Palu Banten dll dan bayar hutang BPJS yang menunggak kalau ada realisasikan janji untuk tidak mencabut subsidi dan menggaji rakyat kita honorer yang diabaikan dan banyak lagi...","1101773066625929216","","","in","","52","193","959","https://x.com/undefined/status/1101773066625929216","120968478",
"1285941276831920129","Wed Jul 22 14:14:26 +0000 2020","2413","Bagaimana Vaksin diuji coba dlu di kelg JOKOWI.. &amp; kelg Mentri2 ...kalangan.. DPR.... MPR.. Klo terbukti aman baru rakyat diberi...vaksin Setujuu....!?!? Kan Presiden mentri DPR MPR &amp; keluarga hrs diutamakan dulu... Spy. Gak terkena covid..","1285941276831920129","","","in","","50","180","654","https://x.com/undefined/status/1285941276831920129","440129081",
"1248101775514599424","Thu Apr 09 04:13:46 +0000 2020","3366","Sebagai contoh kecil saja betapa pak @SBYudhoyono seorang demokratis saat saya msh sesmen BUMN saya secara terbuka dan bahkan di DPR menolak subsidi BBM yg sangat besar yg diinginkan oleh beliau krn saya anggap tdk adil thdp rakyat - tapi beliau tidak serta-merta memecat saya.","1248101775514599424","","","in","","84","465","850","https://x.com/undefined/status/1248101775514599424","1117990249806721024",
"1092572753322885121","Mon Feb 04 23:56:58 +0000 2019","951","Yg hoax esemka dia Yg ingkar janji dia Yg bohong dia Yg cabut subsidi dia Yg impor dia Yg hutang dia Yg naikkan bbm&amp;TDL dia.. Kok dia yg merasa sabar..?! #HoaxPropagandaRusia #PrabowoSandiIndonesiaJaya Presiden Jkw: Sabar Ada Batasnya Dipikir Saya Takut https://t.co/AwsI44R7x7","1092572753322885121","","","in","","104","268","634","https://x.com/undefined/status/1092572753322885121","308824504",
"1106804866196791302","Sat Mar 16 06:30:18 +0000 2019","1060","Istilahnya diresmikan. Semua pejabat tinggi negara diresmikan dgn SK Presiden termasuk anggota DPR/DPD/MPR hakim agung hakim MK dll. Tp Presiden bukan yg memilih/mengangkat. Itu prosedur ketatanegaraan saja.","1106804866196791302","","","in","","8","91","212","https://x.com/undefined/status/1106804866196791302","282006208",
"2071669810295910475","Mon Jun 29 18:59:07 +0000 2026","1674","Yall not ready for my Blade when this demo hits #IGBLN https://t.co/GbNzu3lDAT","2071669810295910475","https://pbs.twimg.com/amplify_video_thumb/2071669627290058752/img/lgtCZolydJpVbSjE.jpg","","en","","11","16","143","https://x.com/undefined/status/2071669810295910475","927357334338273280",
"491531486730809344","Tue Jul 22 10:33:33 +0000 2014","3","Indonesia bukan untuk diperebutkan. Indonesia untuk dicintai. Kalau tidak bisa mencintai dengan cara menjadi presiden jangan ngambek","491531486730809344","","","in","","0","2","157","https://x.com/undefined/status/491531486730809344","1422951168",
"2072687255710220468","Thu Jul 02 14:22:05 +0000 2026","6271","aku list semua beasiswa yang aku liat di TL hope it helps. btw itu aku notes bbrapa ga bisa utk maba dan kampus mitra (HADEH NASIB GA TOP 10 BIKELAHHHH) https://t.co/4lcIRzfIKy","2072687255710220468","https://pbs.twimg.com/media/HMOqEY7a8AAskUY.jpg","","in","","15","58","889","https://x.com/undefined/status/2072687255710220468","1938199029248344064",
"1061979729866027010","Mon Nov 12 13:51:12 +0000 2018","6976","Bagi Rakyat yang menyeramkan bukan Sontoloyo &amp; Genderuwo. Tapi yang menyeramkan adalah: Ingkar Janji Tol Naik Sembako Naik Listrik Naik Pajak Naik BBM Naik BPJS Naik Gas Naik Harga2 Naik Biaya hidup Naik Cari kerja susah Semua Impor","1061979729866027010","","","in","","378","1767","2902","https://x.com/undefined/status/1061979729866027010","122020937",
"934646799406579712","Sun Nov 26 04:55:36 +0000 2017","801","Para Menteri Kabinet kerja hadir diacara ngunduh mantu Putri Presiden @jokowi Mbak Kahiyang dan Mas Bobby di Medan. Acara yg menjujung tinggi adat istiadat Nusantara yg kaya raya #PernikahanBudaya https://t.co/YZuybehtdK","934646799406579712","https://pbs.twimg.com/media/DPiISFxUEAAFnb3.jpg","","in","","13","97","210","https://x.com/undefined/status/934646799406579712","151313825",
"803517279761637376","Tue Nov 29 08:33:42 +0000 2016","252","Ada berapa jumlah Muslim di DPR MPR??? kenapa harus Rakyat yg DEMO?. Kan ada Wakil Rakyat? - ADP","803517279761637376","","","in","","53","171","153","https://x.com/undefined/status/803517279761637376","200071462",
"1169965679824367619","Fri Sep 06 13:28:49 +0000 2019","1334","Sangat sepakat dengan himbauan Presiden @jokowi Kalau sampai mobil dinas kabinet pakai mobil selain mobil Esemka ya kebangetan Ayo pakai mobil Esemka sbg Mobil Dinas para menteri kabinet 2019-2024","1169965679824367619","","","in","","68","156","736","https://x.com/undefined/status/1169965679824367619","30648872",
"1220342032729690112","Thu Jan 23 13:46:28 +0000 2020","1195","FPKS DPRRI; Pemerintah Bayar Utang Ratusan Triliun Bisa Kenapa Subsidi BPJS Gak Bisa?! - VIVA https://t.co/rSpGE9zSjT","1220342032729690112","","","in","","23","63","384","https://x.com/undefined/status/1220342032729690112","86012022",
"525544783201046529","Fri Oct 24 07:10:15 +0000 2014","2","Masalah lingkungan di Indonesia msh bnyk &amp; terus nambah. Siapa yg bertanggung jawab? Kita: rakyat &amp; pemerintah #PRke7 http://t.co/rvVVDbgowO","525544783201046529","https://pbs.twimg.com/media/B0nKt3fCMAAXPom.jpg","","in","","0","0","7","https://x.com/undefined/status/525544783201046529","106038219",
"1275688688060596226","Wed Jun 24 07:14:19 +0000 2020","3625","Demo besar menolak RUU HIP terjadi di bbrpa tempat. Trtma di depan gedung DPR MPR RI. Tp tak satu pun media TV yg memberitakannya scra life. Ini mirip kejadian saat reuni 212 desember 2018 lalu yg mana saat itu hanya @tvOneNews yg live. https://t.co/36M8HyfQ2u","1275688688060596226","https://pbs.twimg.com/media/EbQoDMkXYAAHt0m.jpg","","in","","71","209","1567","https://x.com/undefined/status/1275688688060596226","1065968307331719168",
"1147759854280269824","Sun Jul 07 06:50:48 +0000 2019","885","Presiden wong cilik. Cilik utekke Presiden rakyat kecil. Kecil otaknya Yang Kaya Raya semakin dimanja ada subsidi ini itu + pajak ini itu pun turun Kami pendukung Prabowo yang mencita-citakan bangsa ini adil makmur mengucapkan TAI KUCING https://t.co/6xKANtcoUu","1147759854280269824","","","in","","16","62","282","https://x.com/undefined/status/1147759854280269824","3177957847",
"1192331934094913536","Thu Nov 07 06:44:20 +0000 2019","4282","Berhentilah main drama. Iuran BPJS itu naik krn pemerintah dan DPR tdk menganggarkan dlm APBN utk menutup defisit @BPJSKesehatanRI. Saat dinaikkan lewat keputusan Presiden anggota @DPR_RI dan partai pura2 galak ke BPJS pdhl penyebab naik adalah keseoakatan mereka dlm APBN","1192331934094913536","","","in","","106","222","1629","https://x.com/undefined/status/1192331934094913536","1117990249806721024",
"842730747819507712","Fri Mar 17 13:34:02 +0000 2017","575","Jokowi: Harga BBM Naik Dikit Demo yang Korupsi Gede-gede itu yang Didemo. https://t.co/Y85FxH73TM","842730747819507712","","","in","","147","139","499","https://x.com/undefined/status/842730747819507712","23343960",
"481263002222469121","Tue Jun 24 02:30:15 +0000 2014","2","Denda 20 juta Rupiah untuk pengunjung Taman Monas yang jajan di PKL #JktNews http://t.co/dFa95Zp31v","481263002222469121","","","in","","0","2","18","https://x.com/undefined/status/481263002222469121","106038219",
"1206111474755809280","Sun Dec 15 07:19:18 +0000 2019","3235","Mari kita dukung Bu @susipudjiastuti kembali jadi Menteri KKP. orang brpengalaman &amp; nasionalis yg benar2 mengerti laut Indonesia. Pak Presiden @jokowi mohon pada perombakan kabinet mendatang kembalikan Bu Susi mengepalai KKP. Laut kaya harus diurus orang yg mampu &amp; mumpuni.","1206111474755809280","","","in","","86","159","1877","https://x.com/undefined/status/1206111474755809280","184007180",
"491584926781693953","Tue Jul 22 14:05:54 +0000 2014","4","Thanks God Alhamdulillah. Jokowi sah menjadi presiden","491584926781693953","","","in","","4","6","77","https://x.com/undefined/status/491584926781693953","1422951168",
"1222065736664772610","Tue Jan 28 07:55:51 +0000 2020","1715","FPKS DPRRI:Alhamdulillah Pemerintah Mendengarkan Kami Yg Perjuangkan Nasib Rakyat Kecil Menolak Pencabutan Subsidi dan Kenaikan Harga LPG 3 Kg. Dlm rapat di komisi VII DPRRI Menteri ESDM nyatakan sepakat unt tak naikkan harga dan tak cabut subsidi. https://t.co/60J8S87S62","1222065736664772610","","","in","","62","119","461","https://x.com/undefined/status/1222065736664772610","86012022",
"885834228721635328","Fri Jul 14 12:11:52 +0000 2017","208","Rumah Murah Subsidi Pemerintah DP 1% Presiden Jokowi: Mosok pengusaha bangun gak untung? mana ada? https://t.co/rqiU2VN3Z2","885834228721635328","https://pbs.twimg.com/ext_tw_video_thumb/885833530403454977/pu/img/SGTURefT_TWI_WM0.jpg","","in","","22","23","237","https://x.com/undefined/status/885834228721635328","363128593",
"1066545238951383042","Sun Nov 25 04:12:55 +0000 2018","328","*Mati Listrik satu jam* Orang di Pulau Jawa: PLN Bangsad!! Orang di Luar Pulau Jawa: Dasar Lemah u bangsad - *Subsidi BBM dicabut* Orang di pulau jawa: Pemerintah bangsad! Orang di luar pulau jawa: Lemah u bangsad ","1066545238951383042","","","in","","36","46","939","https://x.com/undefined/status/1066545238951383042","872572075340292097",
